{
  "book_id": "sect_lore",
  "name": "九洲宗门录",
  "description": "九洲主要宗门详细信息（中洲卷详订版）",
  "entries": [
    {
      "entry_id": "xuanqing_sect",
      "name": "玄清宗",
      "keys": [
        "玄清宗",
        "清妙山",
        "法修",
        "四殿八院",
        "万道碑",
        "天律钟",
        "清妙法会",
        "时律之域"
      ],
      "content": "中洲清妙山，天下法修圣地。源承闻人钰竹酒派，历史悠久。镇派之宝：万道碑（闻人钰飞升前刻下的毕生感悟，万法之源）、天律钟（道藏重器，可镇压地脉调节时序）。核心底蕴：山内核蕴'时律之域'，光阴流速与外界迥异，弟子闭关一日可抵外界百日。组织结构：四殿八院。四殿：执律殿（戒律守卫）、内务殿（资源调度）、传功殿（功法传承）、外事殿（对外交流）。八院：阵院、符院、术院、推演院、魂院、丹器院、战院、综理院。弟子等级：外门→内门→真传→长老亲传。重要活动：清妙法会（五科并举：破阵、绘符、演术、辩难、斗战）。飞升记录：十一人。战略储备：历代渡劫期太上长老以秘法压制修为，积累了一批万象境乃至归一期的古老存在。",
      "category": "world_lore",
      "weight": 280,
      "scan_depth": 2,
      "sticky": 0,
      "cooldown": 3,
      "max_tokens": 250
    },
    {
      "entry_id": "shenwu_men",
      "name": "神武门",
      "keys": [
        "神武门",
        "龙陨山脉",
        "武修",
        "三殿五军",
        "白禾",
        "百战枪诀",
        "血战秘境",
        "武祖殿"
      ],
      "content": "中洲北境龙陨山脉，天下武修祖庭。源出白禾道统，与白家渊源极深但相互独立。镇派之宝：武祖殿（供奉白禾留下的战斗化身，危难时可爆发归一期战力）、血战秘境（模拟战场，与战意投影厮杀）、神兵冢（收藏历代强者兵器）。组织结构：三殿五军三院一部。三殿：传功殿、砺锋殿、刑战殿。五军：破阵军、掠影军、御山军、羽林军、巡天军。三院：战法学院、神机院、砺体院。一部：执律部（巡天特战队）。弟子等级：外门（战徒）→内门（战卫）→真传（战将）。飞升记录：十人。",
      "category": "world_lore",
      "weight": 270,
      "scan_depth": 2,
      "sticky": 0,
      "cooldown": 3,
      "max_tokens": 220
    },

    {
      "entry_id": "fulong_gong",
      "name": "扶龙宫",
      "keys": [
        "扶龙宫",
        "皇城",
        "皇室",
        "皇极惊世典",
        "九龙玺",
        "靖龙王",
        "化龙池",
        "承运殿"
      ],
      "content": "中洲神都皇城之内，皇室倾举国之力所建修行学府。本质接近皇室修仙学院。核心建筑：承运殿、潜龙阁、百艺苑、化龙池（引龙脉灵气汇聚，有洗练灵根之效）。根本大法：《皇极惊世典》。镇宫之宝：九龙玺（地品道藏，可调用地脉之力）。历史上仅有一位外姓弟子靖龙王李胤成功飞升——阵斩十大妖王后借磅礴国运直接引动飞升天劫。弟子多为皇室宗亲与功勋后代，生活优渥但约束极多。",
      "category": "world_lore",
      "weight": 250,
      "scan_depth": 2,
      "sticky": 0,
      "cooldown": 3,
      "max_tokens": 180
    },
    {
      "entry_id": "hongchen_ge",
      "name": "红尘阁",
      "keys": [
        "红尘阁",
        "情报",
        "红尘渡厄经",
        "七情六欲",
        "幻境",
        "众生谱",
        "千面",
        "四使"
      ],
      "content": "天下情报之宗，表面是遍布九洲的风月场所（寻芳楼、知音阁、百花舫等），实则为庞大情报网络。核心传承：《红尘渡厄经》（引导修行者体验、观察、掌控乃至超脱七情六欲）。镇阁之宝：众生谱（地品道藏~天品道藏，一面不断流动光影的玉壁，能显现重要人物的情绪波动、人际关系网乃至部分心声碎片）。核心枢纽：红尘幻境（移动秘境，依托幻阵与空间法则构建，唯有邀请或信物方可进入）。组织结构：阁主'千面'与四使——琴使（情报）、棋使（战略）、书使（传承）、画使（执行）。无飞升之秘：历代高手修为极致后选择'化入红尘'，神念意志融入众生情欲网络。",
      "category": "world_lore",
      "weight": 240,
      "scan_depth": 2,
      "sticky": 0,
      "cooldown": 3,
      "max_tokens": 200
    }
  ]
}