{
  "book_id": "jiuzhou_geography",
  "name": "九洲地理",
  "description": "九洲大陆各洲地理、气候、种族、势力概况",
  "entries": [
    {
      "entry_id": "xianmu_zhou",
      "name": "仙木洲",
      "keys": ["仙木洲", "万妖之森", "丹道", "建木", "百草城", "万森罗阙"],
      "content": "九洲之东，超过九成地域被无尽太古森林覆盖。地表由建木根系形成根脊与根谷，巨大藤蔓连接树冠形成空中廊道。温暖潮湿，建木树冠自行凝聚灵雨。核心地标：建木（直径万里的世界树）、百草城（立体城市，万森罗阙总部）。岁主：建木（生命法则化身）。法则显化：青龙孟章（东方之灵，司掌生机与春雨）。主要种族：精灵（建木直系，高傲优雅）、妖族（兽禽虫修炼而成，数量最多）、人族（八洲动乱后迁入，带来炼丹技术）。统治机构：万森罗阙（丹修联盟），核心战力为万灵战团、木修、丹道。最高法则：木石之盟（禁止过度破坏生态）。",
      "category": "world_lore",
      "weight": 240,
      "scan_depth": 3,
      "sticky": 0,
      "cooldown": 3,
      "max_tokens": 200
    },
    {
      "entry_id": "zhong_zhou",
      "name": "中洲",
      "keys": ["中洲", "大宁王朝", "人道王庭", "宁都", "九鼎", "天垣山脉"],
      "content": "九洲之核心，大宁王朝根本。最富庶、人口最密集之地，四季分明，风调雨顺。岁主：烛龙（时序法则化身）。核心地标：宁都（王朝首都，龙脉汇聚）、九鼎（镇国之器，分布于王都及八方巨城）、天垣山脉（龙脉主干）。统治核心：大宁王朝，以苍生道立国，帝王必修《九鼎苍生诀》，修为与国运绑定。治理体系：三省六部、天监司（修士特务与司法机构）、烛龙卫（王朝直属超凡军团）、灵约体系（宗门需缴纳三成资源换取合法地位）。境内顶级宗门：玄清宗、神武门、扶龙宫、红尘阁。顶尖门阀：白家（军武第一）、闻人家（文华第一）、苍林家（丹阵双绝）等。",
      "category": "world_lore",
      "weight": 260,
      "scan_depth": 3,
      "sticky": 0,
      "cooldown": 3,
      "max_tokens": 220
    },
    {
      "entry_id": "moshazhou",
      "name": "漠沙洲",
      "keys": ["漠沙洲", "沙漠", "后土", "归藏宗", "尘劫", "千泪石窟"],
      "content": "九洲之西北，大地母神后土沉寂之地。无尽沙海、黑色石山、巨大裂谷（后土之痕）、流沙陷阱。气候：尘劫沙暴，酷热与严寒交替。岁主：后土（大地法则化身，处于沉寂状态）。核心地标：后土之心（最荒芜死寂之地，归藏宗朝圣之所）、泣血绿洲（蕴含地母之泪）、千泪石窟（最大绿洲与人口聚居地，归藏宗总坛）、风蚀王座（巨石林）。主要势力：归藏宗（守望后土的宗门）、沙民部落、荒漠劫修。法则与文化：后土沉寂导致荒芜，归藏宗修士承纳其伤。",
      "category": "world_lore",
      "weight": 230,
      "scan_depth": 3,
      "sticky": 0,
      "cooldown": 3,
      "max_tokens": 180
    },
    {
      "entry_id": "biyuan_zhou",
      "name": "碧渊洲",
      "keys": ["碧渊洲", "海洋", "水族", "归墟", "海眼", "潮汐", "汐音宗"],
      "content": "九洲之南，海洋大洲。陆地破碎为群岛，海底深渊通向归墟海眼。气候受归墟潮汐影响，海平面周期性涨落。岁主：归墟（万水之源、万物终结）。法则显化：玄武执明（玄龟与灵蛇交合，守护归墟调节水元）。主要种族：水族（统治族群，人鱼、龙族等），人族（渔猎与海上贸易）。统治机构：碧渊龙宫（龙族统治）。核心宗门：汐音宗（音波功法）、海王宗、瀚海书院。",
      "category": "world_lore",
      "weight": 220,
      "scan_depth": 3,
      "sticky": 0,
      "cooldown": 3,
      "max_tokens": 160
    },
    {
      "entry_id": "chiyang_zhou",
      "name": "炽阳洲",
      "keys": ["炽阳洲", "沙漠", "火焰", "熔岩", "煌", "若木扶桑", "朱雀", "乾阳山"],
      "content": "九洲之西，高温大洲。地表被熔岩河流与永不熄灭的烈焰分割。岁主：煌（光热能量法则化身）。法则三相：若木扶桑（时序架构）、朱雀陵光（毁灭中的重生）、大日金乌（十只太阳精灵）。主要宗门：乾阳宗（火修与阵法）、焚天宗、烬灭寺。",
      "category": "world_lore",
      "weight": 220,
      "scan_depth": 3,
      "sticky": 0,
      "cooldown": 3,
      "max_tokens": 140
    },
    {
      "entry_id": "cangxuan_zhou",
      "name": "苍玄洲",
      "keys": ["苍玄洲", "剑修", "铩", "锋锐", "剑冢", "白虎"],
      "content": "九洲之北，剑修圣地。空气中弥漫无形的锐意，凡人易被割伤。岁主：铩（锋锐断裂杀伐法则化身）。法则显化：白虎监兵（通体雪白，啸声裂金石）。核心宗门：苍玄宗（剑修为主，与大宁王朝结盟但反感凡人介入修仙事务）、万剑阁。",
      "category": "world_lore",
      "weight": 220,
      "scan_depth": 3,
      "sticky": 0,
      "cooldown": 3,
      "max_tokens": 140
    },
    {
      "entry_id": "xingyun_zhou",
      "name": "星陨洲",
      "keys": ["星陨洲", "天穹", "星辰", "律", "因果", "天机", "窥天司"],
      "content": "九洲之上，浮空大陆。由破碎星辰与陨石构成，重力混乱。岁主：律（数学规律因果律化身）。法则显化：阴阳鱼（少年阳执白象征规律秩序，少女阴执黑象征变数混沌，二者对弈推演万物可能）。核心宗门：窥天司（星象卜算）、天机阁、陨星宗。",
      "category": "world_lore",
      "weight": 220,
      "scan_depth": 3,
      "sticky": 0,
      "cooldown": 3,
      "max_tokens": 150
    },
    {
      "entry_id": "youming_zhou",
      "name": "幽冥洲",
      "keys": ["幽冥洲", "死亡", "幽冥", "混沌", "九幽骸骨", "永寂海"],
      "content": "九洲之下，亡者归宿。被永恒迷雾笼罩，生者难以久存。岁主：混沌（虚无熵增寂灭法则化身）。法则显化：九幽骸骨（太古神魔遗骸，被混沌侵蚀同化）。核心宗门：幽冥宗（死亡法则）、黄泉阁。",
      "category": "world_lore",
      "weight": 220,
      "scan_depth": 3,
      "sticky": 0,
      "cooldown": 3,
      "max_tokens": 130
    },
    {
      "entry_id": "nanji_zhou",
      "name": "南极洲",
      "keys": ["南极洲", "极寒", "冰雪", "永夜", "山城派"],
      "content": "九洲之极南，永夜与极寒之地。阳光微弱，灵气稀薄但极度纯净。核心宗门：山城派（体修与耐寒功法）、冰心宗。",
      "category": "world_lore",
      "weight": 210,
      "scan_depth": 3,
      "sticky": 0,
      "cooldown": 3,
      "max_tokens": 100
    }
  ]
}
