{
  "book_id": "fulong_sect",
  "name": "扶龙宫知识库",
  "description": "扶龙宫相关的基础知识碎片",
  "entries": [
    {
      "entry_id": "fulong_overview",
      "name": "扶龙宫概览",
      "keys": [
        "扶龙宫",
        "皇城",
        "龙脉",
        "皇室学府"
      ],
      "content": "扶龙宫坐落于中洲神都皇城东北角，占据一片极为广阔的宫苑区域，与皇宫有高墙甬道相连又自成一体。尽享王朝龙脉之气滋养，灵气之浓郁精纯冠绝中洲。一砖一瓦皆为皇家制式，金碧辉煌气势恢宏。核心建筑包括承运殿（主殿讲法）、潜龙阁（藏书传承）、百艺苑（丹房器室演武场）、化龙池（龙脉灵气汇聚，洗练灵根之禁地）。",
      "category": "world_lore",
      "weight": 220,
      "scan_depth": 3,
      "sticky": 0,
      "cooldown": 3,
      "max_tokens": 180
    },
    {
      "entry_id": "fulong_rules",
      "name": "扶龙宫宫规",
      "keys": [
        "宫规",
        "扶龙",
        "戒律",
        "皇室",
        "礼仪"
      ],
      "content": "扶龙宫宫规严格：一、尊皇命，以侍奉王朝为首要使命；二、宫中礼仪不得逾越，见宫主与皇室成员需行跪礼；三、化龙池乃禁地，非宫主特许不得擅入；四、皇室秘传功法外泄者，诛连九族；五、弟子须学习帝王心术与治国策论，成绩计入考核。与外宗弟子相比，扶龙宫弟子约束最多，但资源最优渥。",
      "category": "rule_knowledge",
      "weight": 200,
      "scan_depth": 2,
      "sticky": 0,
      "cooldown": 5,
      "max_tokens": 190
    },
    {
      "entry_id": "fulong_trial",
      "name": "扶龙宫入门考核",
      "keys": [
        "入门",
        "考核",
        "扶龙",
        "皇族",
        "推荐"
      ],
      "content": "扶龙宫入门不走公开试炼之路，而是推荐制。核心弟子来源：皇室宗亲直系入宫；功勋子弟经家族推荐后参加宫中考核——考校文武基础与忠诚度；外招天才需由朝中重臣或宫主亲自举荐，经严格审查后方可入选。考核内容包括基础修为、应对策论与忠君誓言。非皇室弟子的晋升天花板低于宗室子弟。",
      "category": "world_lore",
      "weight": 200,
      "scan_depth": 3,
      "sticky": 0,
      "cooldown": 3,
      "max_tokens": 190
    },
    {
      "entry_id": "fulong_daily",
      "name": "扶龙宫弟子日常",
      "keys": [
        "弟子",
        "日常",
        "皇室",
        "礼仪",
        "修行"
      ],
      "content": "扶龙宫弟子作息严格规制：卯时起床，梳洗更衣后着宫服列队；辰时至午时，随宫中教习修行《皇极惊世典》基础篇，或至百艺苑各坊修习专项（丹器阵符等）；午时用膳，宫中用度奢华，灵食精粹非外宗可比；未时至申时，学习帝王心术、治国策论、礼仪外交等课程；酉时自由修炼或入化龙池（需特许）；戌时必须参加晚课（宫主或长老讲法）；亥时歇息。",
      "category": "world_lore",
      "weight": 190,
      "scan_depth": 2,
      "sticky": 0,
      "cooldown": 3,
      "max_tokens": 210
    },
    {
      "entry_id": "fulong_hualong",
      "name": "化龙池",
      "keys": [
        "化龙池",
        "龙脉",
        "洗练",
        "灵根",
        "淬炼"
      ],
      "content": "化龙池乃扶龙宫禁地，位于承运殿地下深处。引大宁王朝龙脉灵气汇聚而成的一方池水，有洗练灵根、易筋锻骨之奇效。池水呈金色，氤氲升腾如龙形。唯立大功之弟子方可入内，每次入池时间严格限制在半个时辰以内，否则有被龙气反噬之危。历代扶龙宫高手几乎都曾受益于化龙池的淬炼。",
      "category": "location_info",
      "weight": 180,
      "scan_depth": 2,
      "sticky": 0,
      "cooldown": 0,
      "max_tokens": 170
    },
    {
      "entry_id": "fulong_yanyi",
      "name": "百艺苑",
      "keys": [
        "百艺苑",
        "丹房",
        "器室",
        "演武场",
        "设施"
      ],
      "content": "百艺苑占地极广，划分出丹房、器室、演武场、悟道静室、阵法阁等多个功能区域。所有设施皆为九洲顶尖：丹房配有地火炉眼，器室有百年积累的各类材料，演武场下方铺设有精密阵纹可模拟各种战斗环境。弟子可凭身份牌借用设施，但高级区域需宫主特许。",
      "category": "location_info",
      "weight": 160,
      "scan_depth": 2,
      "sticky": 0,
      "cooldown": 0,
      "max_tokens": 150
    },
    {
      "entry_id": "jiulong_xi",
      "name": "九龙玺",
      "keys": [
        "九龙玺",
        "镇宫之宝",
        "道藏",
        "地脉",
        "山河盘"
      ],
      "content": "九龙玺是扶龙宫镇宫之宝，并非一方玉玺，而是一件巨大的山河盘状法宝，上刻大宁万里疆域，有九道金色龙气环绕其上缓缓游走。此宝可调动王朝疆域内部分地脉之力，攻防一体亦可镇压国运，品级为地品道藏。唯宫主与皇帝方可驱动，运转时山河盘上对应区域会亮起，龙气咆哮，声震皇城。",
      "category": "world_lore",
      "weight": 230,
      "scan_depth": 2,
      "sticky": 0,
      "cooldown": 3,
      "max_tokens": 170
    },
    {
      "entry_id": "jinglong_wang",
      "name": "靖龙王李胤",
      "keys": [
        "靖龙王",
        "李胤",
        "飞升",
        "十大妖王",
        "军户",
        "国运"
      ],
      "content": "靖龙王李胤是扶龙宫历史上唯一一位非宁氏皇族的外姓飞升者。出身边境军户之子，天资绝伦，因救驾之功被破格录入扶龙宫。入宫后不改军中悍勇，将《皇极惊世典》与自身杀伐之术结合，走出一条以武卫道之路。仙元约4800年，边疆十大妖王作乱，李胤率军出征鏖战十年，阵斩十大妖王于国境线上。凯旋回朝之日于皇城门前，沐浴万民感念与最鼎盛国运，借磅礴国运直接引动飞升天劫，以手中战刀劈碎最后一道劫雷肉身成仙。宁帝追封异姓王靖龙。",
      "category": "npc_lore",
      "weight": 250,
      "scan_depth": 2,
      "sticky": 0,
      "cooldown": 3,
      "max_tokens": 230
    },
    {
      "entry_id": "chengyun_hall",
      "name": "承运殿",
      "keys": [
        "承运殿",
        "主殿",
        "大典",
        "讲法",
        "琉璃瓦"
      ],
      "content": "承运殿是扶龙宫主殿，用于大典及讲法。殿顶覆以皇家专用的明黄色琉璃瓦，日光下犹如一团燃烧的金色火焰，远在皇城外都能望见。殿内金柱盘龙，地面铺以灵气氤氲的白玉砖，正中最上方设九龙御座——宫主讲法时坐于此位，象征代天子传授道法。每月朔望之日，宫主在此开坛讲法，所有弟子必须到场。",
      "category": "location_info",
      "weight": 190,
      "scan_depth": 2,
      "sticky": 0,
      "cooldown": 0,
      "max_tokens": 190
    },
    {
      "entry_id": "qianlong_ge",
      "name": "潜龙阁",
      "keys": [
        "潜龙阁",
        "藏经",
        "皇室",
        "功法",
        "戒备"
      ],
      "content": "潜龙阁是扶龙宫藏书与传承之地，收集了皇室数千年来网罗的天下功法。阁楼共五层，越往上功法越珍贵。一层至三层对全体弟子开放，四层需宫主特许方可进入（藏有《皇极惊世典》中卷以下内容和各大宗门不传之秘的抄本），五层仅宫主与皇帝可入（传说藏有太祖皇帝留下的手札，记录着王朝初建时的秘密）。阁外有烛龙卫精锐日夜守卫，擅闯者格杀勿论。",
      "category": "location_info",
      "weight": 200,
      "scan_depth": 2,
      "sticky": 0,
      "cooldown": 0,
      "max_tokens": 200
    },
    {
      "entry_id": "fulong_dilemmas",
      "name": "扶龙宫三大困境",
      "keys": [
        "困境",
        "缺乏磨砺",
        "因果深重",
        "外姓隔阂"
      ],
      "content": "扶龙宫虽然资源无尽，但存在三大困境。一、缺乏磨砺：过于优渥的环境缺乏生死间的磨砺，弟子实战能力往往逊于同阶神武门甚至玄清宗弟子，易成温室花朵。二、因果深重：修行与王朝气运绑定过深，一荣俱荣一损俱损，若王朝动荡，弟子修为亦会受影响。三、外姓隔阂：外姓弟子无论多优秀，很难接触到最核心的皇室秘传，天花板清晰可见，这也是史上仅一位外姓飞升者的根本原因。",
      "category": "world_lore",
      "weight": 210,
      "scan_depth": 2,
      "sticky": 0,
      "cooldown": 3,
      "max_tokens": 200
    },
    {
      "entry_id": "fulong_security",
      "name": "扶龙宫守备",
      "keys": ["守备", "规矩", "内外之别", "烛龙卫", "潜龙阁", "化龙池"],
      "content": "扶龙宫的守备是整个中洲最森严的——因为这里住着皇室子弟。潜龙阁外日夜有烛龙卫精锐把守，擅闯者格杀勿论。化龙池入口有单独的阵法锁，需宫主特许令牌方可开启。弟子不得在宫中奔跑喧哗，违者罚抄宫规十遍。最有意思的一条：内宫弟子与外宫弟子走不同的门——不是明令禁止，而是所有人都默认这条规矩，没人说破。",
      "category": "rule_knowledge",
      "weight": 170,
      "scan_depth": 2,
      "sticky": 0,
      "cooldown": 0,
      "max_tokens": 200
    },
    {
      "entry_id": "fulong_rank_gap",
      "name": "内宫外宫的隔阂",
      "keys": ["内宫", "外宫", "隔阂", "出身", "宗室", "外姓", "差距"],
      "content": "扶龙宫内宫与外宫之间的隔阂是公开但没人议论的事。内宫弟子——皇室宗亲——吃住用度高一档，功法资源多一层，教习也更有资历。外宫弟子——功勋子弟和外招天才——虽然嘴上不说，但心里都清楚。偶尔有外姓弟子表现特别出色，内宫的人会客气地称赞几句——但那客气里带着一种让人难受的优越感，仿佛在说'你已经很厉害了——但终究跟我们不一样'。",
      "category": "world_lore",
      "weight": 180,
      "scan_depth": 2,
      "sticky": 0,
      "cooldown": 0,
      "max_tokens": 210
    },
    {
      "entry_id": "fulong_first_impression",
      "name": "扶龙宫第一印象",
      "keys": ["第一印象", "皇城", "神都", "琉璃瓦", "承运殿", "金碧辉煌"],
      "content": "第一次踏入扶龙宫的人，最先被震撼的是视觉——承运殿的明黄色琉璃瓦在日光下像一团燃烧的火焰，远在皇城外都能望见。然后是安静——不是没有声音，而是所有声音都被宫墙和规矩压得很低。烛龙卫站得笔直，目光直视前方，像雕像一样一动不动。空气中隐隐有龙脉灵气的气息——那是整个中洲最精纯的灵气，吸一口都觉得修为在动。但同时也有一股无形的压迫感——好像随时有一双眼睛在看着你，提醒你：这是皇室的地方。",
      "category": "world_lore",
      "weight": 170,
      "scan_depth": 2,
      "sticky": 0,
      "cooldown": 0,
      "max_tokens": 230
    }
  ]
}