{
  "book_id": "menfa_lore",
  "name": "中洲门阀志",
  "description": "中洲主要门阀世家详细信息",
  "entries": [
    {
      "entry_id": "bai_family",
      "name": "白家",
      "keys": ["白家", "白禾", "镇国大将军", "军武", "烛龙卫", "神武门", "百战枪诀"],
      "content": "中洲军武第一门阀，源自镇国大将军白禾。家族信条：功名祗向马上取，真是英雄一丈夫。家学核心：《白氏兵略》（兵法阵型杀气运用）、《百战枪诀》（配合沙场杀气发挥最大威力）。家族神兵：破军枪（地品灵宝）、摧城槊（玄品神器）、惊鸿刃（地品灵宝）、镇岳刀（黄品神器）、百战血披风（玄品神器）、武祖铠（黄品道藏）、定风波（玄品道藏，白家至高象征）。与军方、烛龙卫深度绑定，与神武门渊源极深但相互独立。家族秘境：百战血窟。当代家主白启：合体期中期，征北大将军兼烛龙卫大都督。",
      "category": "world_lore",
      "weight": 240,
      "scan_depth": 2,
      "sticky": 0,
      "cooldown": 3,
      "max_tokens": 180
    },
    {
      "entry_id": "canglin_family",
      "name": "苍林家",
      "keys": ["苍林家", "阵修", "丹阵学", "九衢阵图", "丹阵心传", "百阵窟"],
      "content": "中洲丹阵双绝之技术门阀。家传功法《九衢阵图》乃不传之秘。苍林逸风与女雨桐开创丹阵学，将微缩阵法刻入丹心，炼成史上第一枚阵核丹。家学核心：《九衢阵图》《丹阵心传》。家族训言：格物致知，知行合一。政治地位：深得历代宁帝信任，子弟多在工部、天监司、太医院任职。家族秘境：百阵窟。当代家主苍林鸿：化神期。苍林雨桐：炼虚期，丹阵宗师，家族定海神针。",
      "category": "world_lore",
      "weight": 230,
      "scan_depth": 2,
      "sticky": 0,
      "cooldown": 3,
      "max_tokens": 160
    },
    {
      "entry_id": "wenren_family",
      "name": "闻人家",
      "keys": ["闻人家", "闻人钰", "文华", "文官", "千秋笔"],
      "content": "中洲清流文华之宗，源于竹酒派祖师闻人钰。家族信条：立德立功立言，三不朽；曰清曰慎曰勤，三曰箴。家学核心：《竹酒文集》《太上元婴九转诀》。家族至宝：千秋笔（玄品道藏，勾连文气才气与天地灵气）、山河舆图、正冠镜、五弦琴鹤唳、不易砚、焦尾琴碧海。与玄清宗同气连枝，门生故吏遍布朝堂，堪称文官之首。当代家主闻人弘：合体期后期，礼部尚书兼翰林院掌院学士。",
      "category": "world_lore",
      "weight": 230,
      "scan_depth": 2,
      "sticky": 0,
      "cooldown": 3,
      "max_tokens": 160
    },
    {
      "entry_id": "bai_he",
      "name": "武神·白禾",
      "keys": ["白禾", "武神", "镇国大将军", "神武门开创者", "世俗派之祖"],
      "content": "白家始祖，大秦仙朝镇国大将军，世俗派之祖，神武门开创者。于苍玄洲以武证道，临阵连渡三九、六九雷劫，挽帝国于倾颓。后功行圆满，飞升仙界，被尊为武神。一生征战、所用神兵、所创功法，皆为后世武修典范。",
      "category": "npc_lore",
      "weight": 200,
      "scan_depth": 2,
      "sticky": 0,
      "cooldown": 3,
      "max_tokens": 120
    },
    {
      "entry_id": "wenren_yu",
      "name": "文宣公·闻人钰",
      "keys": ["闻人钰", "文宣公", "竹酒派祖师", "太上元婴九转诀"],
      "content": "闻人家始祖，竹酒派祖师，玄清宗前身开创者。一生致力于融汇百家，以文入道。所创《太上元婴九转诀》为天下魂修第一法门。晚年于帝都渡劫时引发焦竹之灾（意外事故），后飞升仙界。后世尊称文宣公。",
      "category": "npc_lore",
      "weight": 200,
      "scan_depth": 2,
      "sticky": 0,
      "cooldown": 3,
      "max_tokens": 120
    }
  ]
}
