{
  "book_id": "hongchen_sect",
  "name": "红尘阁知识库",
  "description": "红尘阁相关的基础知识碎片",
  "entries": [
    {
      "entry_id": "hongchen_overview",
      "name": "红尘阁概览",
      "keys": [
        "红尘阁",
        "情报",
        "寻芳楼",
        "知音阁",
        "据点"
      ],
      "content": "红尘阁无固定山门，大隐于市。表面是遍布九洲的风月场所——寻芳楼、知音阁、百花舫等，实则为庞大情报网络。核心枢纽'红尘幻境'是一处移动秘境，依托于强大幻阵与空间法则构建，唯有得到邀请或持有信物方可通过各据点内的特定通道进入。弟子皆以各种身份隐藏于市井之间，可能是花魁、琴师、说书人、店小二甚至乞丐。",
      "category": "world_lore",
      "weight": 210,
      "scan_depth": 3,
      "sticky": 0,
      "cooldown": 3,
      "max_tokens": 180
    },
    {
      "entry_id": "hongchen_rules",
      "name": "红尘阁阁规",
      "keys": [
        "阁规",
        "红尘",
        "戒律",
        "中立"
      ],
      "content": "红尘阁阁规：一、情报即一切，不得泄露阁内机密，违者追魂散魄；二、保持绝对中立，不得为私人情感影响情报交易；三、隐藏身份为第一要务，暴露者可断尾求生但不得出卖同僚；四、修行《红尘渡厄经》需自我把控，沉沦情欲者自生自灭；五、情报价格明码标价，不得恶意抬价或降价。违反阁规者将由四使之一亲自处理。",
      "category": "rule_knowledge",
      "weight": 200,
      "scan_depth": 2,
      "sticky": 0,
      "cooldown": 5,
      "max_tokens": 190
    },
    {
      "entry_id": "hongchen_trial",
      "name": "红尘阁入门考核",
      "keys": [
        "入门",
        "考核",
        "红尘",
        "幻境",
        "情欲考验"
      ],
      "content": "红尘阁入门考核不对外公开，而是由阁中老人观察物色合适人选。被选中者经历三重考验：第一重'观心'，在据点中以酒色财气试探，观察其心性是否冷静自持；第二重'入幻'，被引入一处小型幻境，在其中经历一场七情六欲的模拟人生，考察其能否保持清醒；第三重'保密'，通过后需立下天道血誓，永不泄露红尘阁机密。",
      "category": "world_lore",
      "weight": 200,
      "scan_depth": 3,
      "sticky": 0,
      "cooldown": 3,
      "max_tokens": 200
    },
    {
      "entry_id": "hongchen_daily",
      "name": "红尘阁门人日常",
      "keys": [
        "门人",
        "日常",
        "隐藏",
        "情报",
        "苦修"
      ],
      "content": "红尘阁门人的日常与常人无异——这正是其修行之道的核心。他们以各种身份融入凡俗：经营茶楼酒肆、演奏乐器、说书唱曲，在日复一日的市井生活中观察人情百态。真正的修行在夜深人静时：根据白日收集到的情欲波动修炼《红尘渡厄经》，整理情报线索通过隐秘渠道上报。每个门人都有一条专属的传递路径，上线只知自己的直接下线。",
      "category": "world_lore",
      "weight": 190,
      "scan_depth": 2,
      "sticky": 0,
      "cooldown": 3,
      "max_tokens": 200
    },
    {
      "entry_id": "hongchen_huanjing",
      "name": "红尘幻境",
      "keys": [
        "红尘幻境",
        "秘境",
        "幻阵",
        "空间",
        "移动"
      ],
      "content": "红尘幻境是红尘阁真正核心所在，一处依托强大幻阵与空间法则构建的移动秘境。外界无法定位其确切位置，唯有通过遍布九洲的据点内特定传送通道方可进入。幻境之内光怪陆离，场景随阁主意志变换。这里既是四使议事的会场，也是顶级情报的交易地点，更是修炼《红尘渡厄经》的终极试炼场——修行者需在其中直面自己内心最深处的欲望。",
      "category": "location_info",
      "weight": 190,
      "scan_depth": 2,
      "sticky": 0,
      "cooldown": 0,
      "max_tokens": 190
    },
    {
      "entry_id": "hongchen_baibao",
      "name": "百花舫",
      "keys": [
        "百花舫",
        "画舫",
        "据点",
        "玉带河"
      ],
      "content": "百花舫是红尘阁在中洲神都玉带河上的一处著名据点。外观是一座三层高的华丽画舫，雕梁画栋，红灯高悬，丝竹之声昼夜不绝。舫中一至二层对外开放，三层仅有特定信物或暗号方可入内，是情报交易和新人考核的常用场所。舫主看似风月场中的老鸨，实则是红尘阁在中洲的重要联系人之一。",
      "category": "location_info",
      "weight": 170,
      "scan_depth": 2,
      "sticky": 0,
      "cooldown": 0,
      "max_tokens": 170
    },
    {
      "entry_id": "zhongsheng_pu",
      "name": "众生谱",
      "keys": [
        "众生谱",
        "法宝",
        "情绪",
        "关系网",
        "玉壁",
        "情报"
      ],
      "content": "众生谱是红尘阁镇阁之宝，并非书卷，而是一面巨大的、不断流动着光影的玉壁。壁上能隐约显现出九洲诸多重要人物的情绪波动、人际关系网乃至部分心声碎片——并非读心术，而是对众生情绪的极致放大和解读。红尘阁的高阶情报人员通过解读众生谱上的光影变化，可以预判各大势力的动向。品级为地品道藏至天品道藏，是红尘阁情报网络的终极核心。",
      "category": "world_lore",
      "weight": 250,
      "scan_depth": 2,
      "sticky": 0,
      "cooldown": 3,
      "max_tokens": 190
    },
    {
      "entry_id": "four_envoys",
      "name": "红尘阁四使",
      "keys": [
        "琴使",
        "棋使",
        "书使",
        "画使",
        "四使"
      ],
      "content": "红尘阁阁主之下有四位最高干部，代号称四使。琴使主管情报搜集与分析，掌控所有据点，能从海量碎片信息中拼出完整图画。棋使主管战略布局、对外交涉、危险任务派遣，负责下棋的人。书使主管功法传承、新弟子培养、内部纪律（红尘律），是传承之根。画使主管业务执行，包括魅惑、刺杀、保护、窃取等具体行动，是出手的人。四位各司其职互不统属，直接对阁主负责。",
      "category": "world_lore",
      "weight": 230,
      "scan_depth": 2,
      "sticky": 0,
      "cooldown": 3,
      "max_tokens": 200
    },
    {
      "entry_id": "hongchen_fight",
      "name": "红尘阁战斗方式",
      "keys": [
        "战斗",
        "幻术",
        "音律",
        "心魔",
        "下毒",
        "诡异"
      ],
      "content": "红尘阁门人极少正面搏杀，其战斗方式诡异莫测。擅长幻术，可在谈笑间让对手陷入七情六欲编织的幻境无法自拔；擅长音律攻击，琴声笛音可杀人于无形；擅长催情与引发心魔，令目标在情绪崩溃中自毁阵脚；也精通下毒之术——红尘阁的毒并非无解，而是烈度刚好能让人做出非理性选择。他们往往杀人于无形，或令目标社会性死亡比肉体死亡更彻底。",
      "category": "world_lore",
      "weight": 220,
      "scan_depth": 2,
      "sticky": 0,
      "cooldown": 3,
      "max_tokens": 200
    },
    {
      "entry_id": "hongchen_immortal",
      "name": "红尘阁无飞升之秘",
      "keys": [
        "飞升",
        "化入红尘",
        "众生皆我",
        "我非众生"
      ],
      "content": "红尘阁的飞升方式是九洲最大未解之谜之一。阁内传闻历代阁主或高手达到修为极致后，并非像传统修士那样渡劫破界飞升仙界，而是选择化入红尘。其身消散，其神念意志则彻底融入那无所不在的众生情欲网络之中，成为一种近乎永恒的存在。此乃《红尘渡厄经》的最终境界——众生皆我，我非众生。因此红尘阁虽无渡劫飞升的记载，却依然拥有深不可测的底蕴。",
      "category": "world_lore",
      "weight": 240,
      "scan_depth": 2,
      "sticky": 0,
      "cooldown": 3,
      "max_tokens": 200
    },
    {
      "entry_id": "hongchen_security",
      "name": "红尘阁守备",
      "keys": ["守备", "安全", "暴露", "暗号", "据点", "验证"],
      "content": "红尘阁没有传统意义上的宗门守备——因为没有人知道所有据点的确切位置。每个据点有独立的暗号系统，每天更换。验证通过后才能进入内部区域。暴露身份的后果由自己承担——红尘阁不会派人救援暴露的暗桩，因为救援本身会暴露更多据点。每个门人都有三条应急脱身路线，但大多数人都没用过——因为敢加入红尘阁的人，都知道自己在做什么。",
      "category": "rule_knowledge",
      "weight": 170,
      "scan_depth": 2,
      "sticky": 0,
      "cooldown": 0,
      "max_tokens": 190
    },
    {
      "entry_id": "hongchen_politics",
      "name": "四使之间的关系",
      "keys": ["四使", "权力", "内斗", "琴使", "棋使", "画使", "书使"],
      "content": "红尘阁四使之间的关系比外界想象的复杂得多。琴使掌握所有情报网络，所以权力最大——棋使对此不满已久，认为战略布局不应听命于情报部门。画使只在乎执行力——谁的指令清晰可行就听谁的，不参与权力斗争。书使负责传承和纪律，置身事外——或者说，她一直在等一个合适的时机。阁主'千面'对此心知肚明但不干预——因为适度的内部制衡有利于维持红尘阁的稳定。",
      "category": "world_lore",
      "weight": 200,
      "scan_depth": 2,
      "sticky": 0,
      "cooldown": 0,
      "max_tokens": 220
    },
    {
      "entry_id": "hongchen_first_impression",
      "name": "红尘阁第一印象",
      "keys": ["幻境", "初见", "红尘幻境", "传送", "眩晕"],
      "content": "第一次被引入红尘幻境的人——会先感到一阵眩晕，像是身体被抽离了原地又在另一个地方重新组装起来。睁开眼睛的时候，可能站在繁华的街市中，也可能在一片荒野里，或者一间茶楼的雅间里。场景随阁主意志变换。空中漂浮着若有若无的丝竹声，四面八方的光线像是从水面下往上看一样微微晃动。幻境里的时间和外界不太一样——但具体差多少，没人说得清楚，因为每个人的体感都不一样。",
      "category": "world_lore",
      "weight": 180,
      "scan_depth": 2,
      "sticky": 0,
      "cooldown": 0,
      "max_tokens": 220
    }
  ]
}