{
  "book_id": "shenwu_sect",
  "name": "神武门知识库",
  "description": "神武门相关的基础知识碎片",
  "entries": [
    {
      "entry_id": "shenwu_overview",
      "name": "神武门概览",
      "keys": [
        "神武门",
        "龙陨山脉",
        "武修",
        "战场"
      ],
      "content": "神武门位于中洲北境龙陨山脉，天下武修祖庭。上古有真龙于此陨落，金铁之气丰沛，煞气冲天。宗门由玄黑石与暗青色铁岩垒砌而成，风格古朴厚重恢弘，宛如一座为力量本身修建的圣殿。千钧道通往主殿，石阶重若千钧，施加了重力阵法，是弟子日常淬炼体魄之路。空气中混合着金铁之气与气血狼烟。",
      "category": "world_lore",
      "weight": 220,
      "scan_depth": 3,
      "sticky": 0,
      "cooldown": 3,
      "max_tokens": 170
    },
    {
      "entry_id": "shenwu_rules",
      "name": "神武门门规",
      "keys": [
        "门规",
        "神武",
        "戒律",
        "刑战殿"
      ],
      "content": "神武门门规：一、强者为尊，但不可欺凌弱小；二、同门切磋点到为止，蓄意重伤者逐出师门；三、战场之上同袍为重，背弃战友者杀无赦；四、修炼杀戮之气不可入魔，心性失控者废其修为；五、尊重对手，胜不骄败不馁。刑战殿铁面无私，执法酷烈，违规者先受三十煞气鞭再依律惩处。",
      "category": "rule_knowledge",
      "weight": 200,
      "scan_depth": 2,
      "sticky": 0,
      "cooldown": 5,
      "max_tokens": 190
    },
    {
      "entry_id": "shenwu_trial",
      "name": "神武门入门试炼",
      "keys": [
        "入门试炼",
        "神武",
        "考核",
        "厮杀",
        "负重",
        "煞气"
      ],
      "content": "神武门入门试炼以残酷著称。第一关'负重远征'：弟子需背负百斤铁甲，一日内从山脚徒步行至千钧道顶，沿途有重力阵法递增压制。第二关'煞气抗性'：立于煞气池边缘，承受龙陨山脉煞气冲刷，坚持越久越好。第三关'实战考核'：与一名内门弟子在试剑台对战，不要求取胜，但必须打满三十个回合不倒。三关皆过方可入门。",
      "category": "world_lore",
      "weight": 210,
      "scan_depth": 3,
      "sticky": 0,
      "cooldown": 3,
      "max_tokens": 200
    },
    {
      "entry_id": "shenwu_daily",
      "name": "神武门弟子日常",
      "keys": [
        "弟子",
        "日常",
        "修炼",
        "晨练",
        "战阵"
      ],
      "content": "神武门弟子日常：寅时起床，先负重蛙跳千钧道一圈热身；卯时集体晨练，于演武场上练习基础体术与战阵配合；辰时至午时，各军分训（破阵军练破阵、掠影军练身法等）；午时食灵兽肉补充气血；未时至酉时，可选择进入血战秘境实战或至战法学院听课；戌时自由淬炼（百炼瀑炼体或千钧道加练）；亥时歇息。每月一次实战考核，排名升降决定资源配给。",
      "category": "world_lore",
      "weight": 190,
      "scan_depth": 2,
      "sticky": 0,
      "cooldown": 3,
      "max_tokens": 220
    },
    {
      "entry_id": "shenwu_shijianta",
      "name": "试剑台",
      "keys": [
        "试剑台",
        "擂台",
        "切磋",
        "比武",
        "黑曜石"
      ],
      "content": "试剑台并非一个擂台，而是数十座悬浮于主峰之间的巨大黑曜石平台，由粗大玄铁锁链相连。弟子于此切磋，气劲交击声如雷鸣般在山间回荡。四周有防护阵法防止逸散的力量伤及观战者。试剑台是神武门最热闹的地方，几乎随时都有人在此对战。",
      "category": "location_info",
      "weight": 170,
      "scan_depth": 2,
      "sticky": 0,
      "cooldown": 0,
      "max_tokens": 140
    },
    {
      "entry_id": "shenwu_bailianpu",
      "name": "百炼瀑",
      "keys": [
        "百炼瀑",
        "炼体",
        "瀑布",
        "元磁重水"
      ],
      "content": "百炼瀑位于龙陨山脉深处，并非普通瀑布，而是从极高处奔涌而下的地下元磁重水，冲击力恐怖。弟子常于其下锻打肉身、修炼韧性。瀑布分七级，第一级相当于受筑基期修士一拳之力，第七级据说连元婴期体修都难以承受。瀑底有前辈雕琢的青石坐台，可供盘坐。",
      "category": "location_info",
      "weight": 170,
      "scan_depth": 2,
      "sticky": 0,
      "cooldown": 0,
      "max_tokens": 160
    },
    {
      "entry_id": "wuzu_hall",
      "name": "武祖殿",
      "keys": [
        "武祖殿",
        "白禾",
        "战斗化身",
        "九阶",
        "最终底蕴"
      ],
      "content": "武祖殿位于龙陨山脉主峰之巅，供奉白禾飞升前留下的一具战斗化身（或一缕不灭战意）。平日静默如雕像，唯宗门危难之际会自主苏醒，爆发出归一期（九阶）的恐怖战力，是神武门最终底蕴。整座大殿以玄黑石筑成，无窗，唯有正中一座白禾的武者雕像巍然而立，散发若有若无的战场杀意。",
      "category": "world_lore",
      "weight": 240,
      "scan_depth": 2,
      "sticky": 0,
      "cooldown": 3,
      "max_tokens": 170
    },
    {
      "entry_id": "xuezhan_mijing",
      "name": "血战秘境",
      "keys": [
        "血战秘境",
        "秘境",
        "战神",
        "战意投影",
        "实战"
      ],
      "content": "血战秘境是白禾以无上神通开辟的小世界，模拟其一生经历过的所有著名战场。门内弟子可进入其中，与白禾当年敌人的战意投影厮杀。秘境中时间流速与外界不同，且受伤不会致死—濒死时会被传送出来。但战斗中的痛苦与疲惫皆为真实，精神意志会在反复战斗中被打磨得无比坚韧。秘境分多层，越深入面对的敌人越强。",
      "category": "world_lore",
      "weight": 230,
      "scan_depth": 2,
      "sticky": 0,
      "cooldown": 3,
      "max_tokens": 190
    },
    {
      "entry_id": "shenbing_zhong",
      "name": "神兵冢",
      "keys": [
        "神兵冢",
        "兵器",
        "器灵",
        "灵宝",
        "神器"
      ],
      "content": "神兵冢并非坟墓，而是一座巨大的兵器库，收藏着历代神武门强者使用过的、产生器灵或蕴含强大战意的兵器（从灵宝到神器不等）。兵器在此修养灵性，等待下一位有缘的主人。弟子若获得认可，可入内尝试获取属于自己的神兵，但需通过器灵的考验。传说最深处藏着白禾年轻时使用过的战枪雏形，数万年来无人能使其认主。",
      "category": "location_info",
      "weight": 220,
      "scan_depth": 2,
      "sticky": 0,
      "cooldown": 3,
      "max_tokens": 190
    },
    {
      "entry_id": "qianjun_dao",
      "name": "千钧道",
      "keys": [
        "千钧道",
        "石阶",
        "重力",
        "淬体",
        "必经之路"
      ],
      "content": "千钧道是通往神武门主殿的漫长石阶，共一千零八十级。每一级台阶都重若千钧，并施加了强大的重力阵法—越往上走重力越大。这是弟子日常淬炼体魄、磨砺意志的必经之路。新入门的弟子第一次走千钧道往往需要一整天，中途倒下无数次；修行有成者已能如履平地。千钧道尽头刻有一行字：'武道无穷，始于足下。'",
      "category": "location_info",
      "weight": 200,
      "scan_depth": 2,
      "sticky": 0,
      "cooldown": 0,
      "max_tokens": 190
    },
    {
      "entry_id": "longyin_ge",
      "name": "龙吟阁",
      "keys": [
        "龙吟阁",
        "藏经阁",
        "战碑",
        "功法",
        "兵器库"
      ],
      "content": "龙吟阁是神武门藏经阁，但不像寻常书斋，更像一座巨大的兵器库与战碑林。功法秘籍常刻于青铜战碑或玉简之上，置于各式神兵利刃之间，以示武学与兵器一体不分的理念。阁中存放着《白氏兵略》、《百战枪诀》等核心功法，以及大量战场杀伐之术。每座战碑前都有一位战意投影守候，弟子需以实力证明自己有资格阅读。",
      "category": "location_info",
      "weight": 200,
      "scan_depth": 2,
      "sticky": 0,
      "cooldown": 0,
      "max_tokens": 190
    },
    {
      "entry_id": "shenwu_three_halls",
      "name": "神武门三殿",
      "keys": [
        "传功殿",
        "砺锋殿",
        "刑战殿"
      ],
      "content": "神武门职能机构为三殿。传功殿掌功法传承与弟子考核，藏有《白氏兵略》、《百战枪诀》及诸多战场杀伐之术。砺锋殿负责丹药、铠甲、兵器的炼制与分配，与器修宗门关系密切。刑战殿掌宗门戒律、执法、追杀叛徒，手段酷烈铁面无私，违规者先受三十煞气鞭再依律惩处。",
      "category": "world_lore",
      "weight": 210,
      "scan_depth": 2,
      "sticky": 0,
      "cooldown": 3,
      "max_tokens": 170
    },
    {
      "entry_id": "shenwu_five_armies",
      "name": "神武门五军",
      "keys": [
        "五军",
        "破阵军",
        "掠影军",
        "御山军",
        "羽林军",
        "巡天军"
      ],
      "content": "神武门五军既是战斗单位也是教学单位。破阵军为重甲攻坚部队，擅破城破阵。掠影军为轻装迅捷部队，擅侦查袭杀游击。御山军为重装防御部队，擅守御结阵。羽林军为门主亲卫，负责教导精英弟子，乃最精锐之师。巡天军负责对外征伐、探索秘境、支援盟友，是主力军团。弟子入门后按体魄与天赋分配至各军，可中途转换但需通过新军的考核。",
      "category": "world_lore",
      "weight": 220,
      "scan_depth": 2,
      "sticky": 0,
      "cooldown": 3,
      "max_tokens": 210
    },
    {
      "entry_id": "shenwu_three_institutes",
      "name": "神武门三院",
      "keys": [
        "战法学院",
        "神机院",
        "砺体院"
      ],
      "content": "神武门三院专注于研究与研发。战法学院不单纯传授杀招，而是研究教授一切与杀伐战斗相关的知识，课程包括《高级杀气运用原理》、《破法体修精要》、《战场阵法分析与破解》、《各洲流派武技比较研究》、《神机单人/小组战术配合》。神机院专注神机的单兵化小型化特种化应用研究。砺体院负责丹药、淬体配方及新一代单兵作战护甲的研发，目标是打造人形神机。",
      "category": "world_lore",
      "weight": 210,
      "scan_depth": 2,
      "sticky": 0,
      "cooldown": 3,
      "max_tokens": 210
    },
    {
      "entry_id": "xuntian_special",
      "name": "巡天特战队",
      "keys": [
        "执律部",
        "巡天特战队",
        "特种",
        "快速反应"
      ],
      "content": "执律部保留执法功能，其精锐'巡天特战队'是宗门的高级快速反应部队。他们不再是普通军队，而是最顶尖的武修顾问和特种任务执行者。接受仙盟或王朝的雇佣或邀请，处理高难度任务：定点清除被魔染的高阶修士、深入险境夺取关键物品、跨境追捕叛徒等。是神武门实力金字塔的顶尖层次。",
      "category": "world_lore",
      "weight": 220,
      "scan_depth": 2,
      "sticky": 0,
      "cooldown": 3,
      "max_tokens": 180
    },
    {
      "entry_id": "shenwu_career",
      "name": "神武门弟子去向",
      "keys": [
        "毕业",
        "去向",
        "巡天",
        "烛龙卫",
        "教官"
      ],
      "content": "神武门弟子毕业后主要去向：加入宗门巡天特战队继续深造；成为王朝烛龙卫高级教官或指挥官；受聘于各大势力担任高级护卫或特种顾问；留在宗门内成为战法学院研究员或教员。无论选择哪条路，神武门弟子的实战能力和战术素养都备受认可，是九洲最受欢迎的高阶武力人才来源之一。",
      "category": "world_lore",
      "weight": 190,
      "scan_depth": 2,
      "sticky": 0,
      "cooldown": 3,
      "max_tokens": 170
    },
    {
      "entry_id": "shenwu_relations",
      "name": "神武门与各方关系",
      "keys": [
        "白家",
        "军方",
        "玄清宗",
        "仙盟",
        "刀锋"
      ],
      "content": "神武门与白家/军方是重要的合作伙伴与人才输送方，而非上下级关系。军方会邀请神武门专家指导训练、采购定制神机；神武门弟子将军方作为最重要的实习和就业基地。与玄清宗的竞争关系从蛮力vs技巧变为终极杀伤效率vs法则掌控广度的路线之争。在仙盟中扮演刀锋与智库的角色，提供最高端武修人才、最先进单兵作战理论和特种神机技术。",
      "category": "world_lore",
      "weight": 210,
      "scan_depth": 2,
      "sticky": 0,
      "cooldown": 3,
      "max_tokens": 200
    },
    {
      "entry_id": "shenwu_security",
      "name": "神武门守备",
      "keys": ["守备", "禁区", "武祖殿", "神兵冢", "巡逻", "夜间"],
      "content": "神武门的守备不像玄清宗那么缜密——强者为尊的地方没人敢在宗门内偷鸡摸狗，因为被抓到后果极其严重。武祖殿和神兵冢深处有战意投影自动守护，外人靠近会被攻击。夜间巡逻由各军轮值——今晚是破阵军就满山都是重甲脚步声，是掠影军就安静得像没人巡逻一样。刑战殿有一座煞气牢，专门关押叛徒和失控入魔的弟子，进去的人不死也废半条命。",
      "category": "rule_knowledge",
      "weight": 170,
      "scan_depth": 2,
      "sticky": 0,
      "cooldown": 0,
      "max_tokens": 200
    },
    {
      "entry_id": "shenwu_five_armies_rivalry",
      "name": "五军之间的较劲",
      "keys": ["五军", "竞争", "破阵军", "掠影军", "御山军", "羽林军", "巡天军"],
      "content": "五军之间的较劲是神武门的日常风景。破阵军重甲步兵，看不起掠影军那些'轻飘飘的跑得快有什么用'；掠影军回敬破阵军'笨重得像乌龟'，说他们转身要三天。御山军——重装防御部队——两边都不参与，但私下里也看不起两边：'我们扛得住的东西你们不一定扛得住。'羽林军最精锐话最少，不参与嘴仗。巡天军是外出征伐的主力，铁鹫带的那支是真的上过战场的——他们对内五军嘴仗从来都是'你们吵，我们先去打了'。",
      "category": "world_lore",
      "weight": 180,
      "scan_depth": 2,
      "sticky": 0,
      "cooldown": 0,
      "max_tokens": 240
    },
    {
      "entry_id": "shenwu_first_impression",
      "name": "神武门第一印象",
      "keys": ["第一印象", "初见", "龙陨山脉", "山门", "煞气"],
      "content": "第一次来神武门的人最先注意到的一定是那股气味——金铁之气混着若有若无的血腥味，是龙陨山脉独有的煞气。然后是声音：千钧道上新兵粗重的喘气声和脚步砸在石阶上的闷响，试剑台上兵器交击的轰鸣在山谷间回荡，远处百炼瀑的冲击声像闷雷一样连绵不绝。脚下的地面是玄黑石铺成的，踩上去比普通石头凉得多——据说是陨铁含量高。抬头是暗青色的铁岩山壁，整座宗门像一座从山体里凿出来的要塞。",
      "category": "world_lore",
      "weight": 170,
      "scan_depth": 2,
      "sticky": 0,
      "cooldown": 0,
      "max_tokens": 230
    },
    {
      "entry_id": "shenwu_interactables",
      "name": "试剑台的刻名与千钧道的脚印",
      "keys": ["试剑台", "千钧道", "刻名", "脚印", "玄铁锁链", "遗迹"],
      "content": "试剑台之间的玄铁锁链上刻着密密麻麻的名字——那是历代打赢一百场以上切磋的弟子的刻名。不同时期的刻痕深浅不一，最老的那些已经被煞气侵蚀得几乎看不清了。千钧道往上的第365级台阶正中有一个深约一寸的脚印，清晰得像是昨天才踩出来的，但据说是一位前辈在某次突破时不由自主踏出的——当时他脚下的重力是外界的几十倍，石阶直接被他踩出了一个脚印。新弟子第一次走千钧道经过那里时，很多人都会特意踩一下那个脚印，算是一种祈福。",
      "category": "location_info",
      "weight": 160,
      "scan_depth": 1,
      "sticky": 0,
      "cooldown": 0,
      "max_tokens": 230
    }
  ]
}