{
  "book_id": "suizhu_history",
  "name": "岁主与历史",
  "description": "九洲岁主（古神/法则化身）信息与历史",
  "entries": [
    {
      "entry_id": "zhulong",
      "name": "烛龙",
      "keys": [
        "烛龙",
        "时间",
        "时序",
        "昼夜",
        "四季",
        "龙脉",
        "太初",
        "混沌"
      ],
      "content": "烛龙是世界诞生后最早诞生的规则化身之一，时间概念本身的化身。世界之初四时无序昼夜不分，烛龙自时光长河源头苏醒，睁眼为昼闭眼为夜，呼吸带来春夏秋冬。龙躯盘踞于中洲大地之下，心跳与地脉融为一体。中洲因此成为时序最稳定的大洲。大宁太祖观烛龙法则创《九鼎苍生诀》，帝王本质上是模仿烛龙，尝试成为人间时序的调节者。王朝失德会引发烛龙法则纠错，表现为异常天灾。烛龙没有情感，不做评判，只关心维持时序稳定运行。",
      "category": "world_lore",
      "weight": 280,
      "scan_depth": 3,
      "sticky": 0,
      "cooldown": 3,
      "max_tokens": 180
    },
    {
      "entry_id": "houtu",
      "name": "后土",
      "keys": [
        "后土",
        "地母",
        "大地",
        "漠沙洲",
        "尘劫",
        "诸神之劫",
        "神殇"
      ],
      "content": "后土皇地祇是大地法则化身，仁慈丰饶。太古时期漠沙洲曾是沃野万里、灵脉奔涌的富饶大陆。诸神之劫中天火坠世，后土以承纳万物之本源神躯硬生生承受绝大部分冲击，保全世界其他部分，自身遭受无法挽回的重创，意志陷入永恒的沉寂与痛苦。其伤痛化为洲陆上的'神殇道痕'。归藏宗修士承纳其伤，于其上感悟。漠沙洲因其沉寂而荒芜。",
      "category": "world_lore",
      "weight": 260,
      "scan_depth": 3,
      "sticky": 0,
      "cooldown": 3,
      "max_tokens": 160
    },
    {
      "entry_id": "jianmu",
      "name": "建木",
      "keys": [
        "建木",
        "生命",
        "青帝",
        "仙木洲",
        "世界树"
      ],
      "content": "建木是生命法则化身，位于仙木洲，直径万里的世界树。三化身：青帝翁（智慧仁慈）、灵曦元君（光辉生长）、木魁（威严力量）。法则显化：青龙孟章（东方之灵，司掌生机与春雨）。",
      "category": "world_lore",
      "weight": 220,
      "scan_depth": 3,
      "sticky": 0,
      "cooldown": 3,
      "max_tokens": 100
    },
    {
      "entry_id": "guixu",
      "name": "归墟",
      "keys": [
        "归墟",
        "万水之源",
        "万物终结",
        "碧渊洲",
        "玄武"
      ],
      "content": "归墟是万水之源、万物终结的法则化身，位于碧渊洲极东海眼。吞噬万物，是万物终焉之地。法则显化：玄武执明（玄龟与灵蛇交合，守护归墟调节水元）。",
      "category": "world_lore",
      "weight": 220,
      "scan_depth": 3,
      "sticky": 0,
      "cooldown": 3,
      "max_tokens": 90
    },
    {
      "entry_id": "huang",
      "name": "煌",
      "keys": [
        "煌",
        "光",
        "热",
        "能量",
        "炽阳洲",
        "若木扶桑",
        "朱雀"
      ],
      "content": "煌是光热能量的先天法则化身，冷酷绝对纯粹。位于炽阳洲。法则三相：若木扶桑（时序架构）、朱雀陵光（毁灭中的重生）、大日金乌（十只太阳精灵巡行天轨）。",
      "category": "world_lore",
      "weight": 220,
      "scan_depth": 3,
      "sticky": 0,
      "cooldown": 3,
      "max_tokens": 90
    },
    {
      "entry_id": "sha",
      "name": "铩",
      "keys": [
        "铩",
        "锋锐",
        "断裂",
        "杀伐",
        "苍玄洲",
        "白虎"
      ],
      "content": "铩是锋锐断裂杀伐的终极法则化身，位于苍玄洲铩谷。法则显化：白虎监兵（通体雪白，啸声裂金石）。苍玄洲空气中弥漫无形的锐意。",
      "category": "world_lore",
      "weight": 220,
      "scan_depth": 3,
      "sticky": 0,
      "cooldown": 3,
      "max_tokens": 80
    },
    {
      "entry_id": "lv",
      "name": "律",
      "keys": [
        "律",
        "数学",
        "规律",
        "因果",
        "星陨洲",
        "阴阳鱼"
      ],
      "content": "律是数学规律因果律物理法则的化身，极致冰冷理性。位于星陨洲。法则显化：阴阳鱼（少年阳执白象征规律秩序，少女阴执黑象征变数混沌，二者对弈推演万物可能）。",
      "category": "world_lore",
      "weight": 220,
      "scan_depth": 3,
      "sticky": 0,
      "cooldown": 3,
      "max_tokens": 90
    },
    {
      "entry_id": "hundun_suizhu",
      "name": "混沌（幽冥洲岁主）",
      "keys": [
        "混沌",
        "虚无",
        "熵增",
        "寂灭",
        "幽冥洲",
        "九幽骸骨"
      ],
      "content": "混沌是虚无未分化无秩序熵增的终极法则化身，位于幽冥洲。法则显化：九幽骸骨（太古神魔遗骸，被混沌侵蚀同化，半埋永寂海边缘）。",
      "category": "world_lore",
      "weight": 220,
      "scan_depth": 3,
      "sticky": 0,
      "cooldown": 3,
      "max_tokens": 80
    },
    {
      "entry_id": "jiuding_cangsheng_jue",
      "name": "九鼎苍生诀",
      "keys": [
        "九鼎苍生诀",
        "苍生道",
        "国运",
        "帝王",
        "龙气"
      ],
      "content": "《九鼎苍生诀》是大宁王朝立国之本。大宁太祖观烛龙法则运行，悟出天地秩序与人间王权相关之道而创。修行此诀的帝王本质上是模仿烛龙，尝试成为人间时序的调节者。修为与国运绑定，王朝兴盛则帝王无敌，王朝衰败则修为反噬。",
      "category": "rule_knowledge",
      "weight": 250,
      "scan_depth": 2,
      "sticky": 0,
      "cooldown": 3,
      "max_tokens": 130
    }
  ]
}